{
  "$schema": "https://json-schema.org/draft/2020-12/schema",
  "$id": "https://github.com/MyD-Org/platform/contracts/catalogo-overlay/v1/schema-overlay.json",
  "title": "ContratoCatalogoOverlayV1",
  "description": "Respuesta 200 de GET {CRM}/api/internal/shop/catalogo-overlay?tenant=…&desde=…&cursor=…&limit=… — página del delta del overlay comercial, ordenada estrictamente por (updatedAt, alegraId) ascendente. No hay borrados: despublicar viaja como visible:false. Precio y stock NO viajan: son de Alegra.",
  "type": "object",
  "additionalProperties": false,
  "required": ["version", "tenant", "items", "nextCursor", "hasMore"],
  "properties": {
    "version": { "const": "v1" },
    "tenant": { "type": "string", "minLength": 1 },
    "items": {
      "description": "Orden estricto (updatedAt, alegraId) ascendente. El desempate por alegraId es lo que hace seguro paginar un lote masivo que comparte updatedAt.",
      "type": "array",
      "items": { "$ref": "#/$defs/ItemOverlay" }
    },
    "nextCursor": {
      "description": "(updatedAt, alegraId) del ÚLTIMO ítem de ESTA página, no del siguiente. null cuando hasMore es false.",
      "oneOf": [{ "$ref": "#/$defs/Cursor" }, { "type": "null" }]
    },
    "hasMore": {
      "description": "true si la query trajo exactamente `limit` filas. Un falso positivo (la próxima página viene vacía) es aceptable.",
      "type": "boolean"
    }
  },
  "$defs": {
    "Uuid": {
      "type": "string",
      "pattern": "^[0-9a-fA-F]{8}-[0-9a-fA-F]{4}-[0-9a-fA-F]{4}-[0-9a-fA-F]{4}-[0-9a-fA-F]{12}$"
    },
    "Cursor": {
      "type": "object",
      "additionalProperties": false,
      "required": ["desde", "cursor"],
      "properties": {
        "desde": { "description": "updatedAt del último ítem de la página.", "type": "string", "format": "date-time" },
        "cursor": { "description": "alegraId del último ítem de la página.", "type": "string", "minLength": 1 }
      }
    },
    "Foto": {
      "type": "object",
      "additionalProperties": false,
      "required": ["url", "w"],
      "properties": {
        "url": {
          "description": "Absoluta, pública e inmutable. El consumidor no la reescribe ni la firma.",
          "type": "string",
          "pattern": "^https://"
        },
        "w": { "description": "Ancho en píxeles de esta variante.", "type": "integer", "minimum": 1 },
        "alt": {
          "description": "Opcional. Cuando falta, la vidriera deriva uno del nombre del producto y nunca deja el atributo vacío.",
          "type": "string",
          "minLength": 1
        }
      }
    },
    "ItemOverlay": {
      "type": "object",
      "additionalProperties": false,
      "required": ["alegraId", "visible", "nombre", "descripcion", "categoriaId", "orden", "tagIds", "fotos", "updatedAt"],
      "properties": {
        "alegraId": {
          "description": "Llave de join con el espejo de Alegra. Es el ÚNICO campo común y estable entre los dos espejos.",
          "type": "string",
          "minLength": 1
        },
        "visible": { "description": "Nace en false (fail-closed). Despublicar viaja acá, no como borrado.", "type": "boolean" },
        "nombre": {
          "description": "null = usar el default de Alegra (description, y si no name).",
          "oneOf": [{ "type": "string", "minLength": 1 }, { "type": "null" }]
        },
        "descripcion": { "oneOf": [{ "type": "string", "minLength": 1 }, { "type": "null" }] },
        "categoriaId": {
          "description": "null = sin clasificar. Referencia un id del payload de taxonomía.",
          "oneOf": [{ "$ref": "#/$defs/Uuid" }, { "type": "null" }]
        },
        "orden": {
          "description": "null = sin destacar (NULLS LAST en la vidriera).",
          "oneOf": [{ "type": "integer", "minimum": 0 }, { "type": "null" }]
        },
        "tagIds": {
          "description": "Referencias por uuid al diccionario de tags, NUNCA nombres embebidos. Orden irrelevante. El consumidor reemplaza el conjunto entero al aplicar el ítem. Un tagId que todavía no conoce no invalida el lote.",
          "type": "array",
          "items": { "$ref": "#/$defs/Uuid" }
        },
        "fotos": {
          "description": "Ordenado; [0] es la portada. Array vacío = sin fotos, que es un estado PUBLICABLE.",
          "type": "array",
          "items": { "$ref": "#/$defs/Foto" }
        },
        "updatedAt": {
          "description": "ISO 8601 (UTC). Reloj de Postgres del CRM, no de la instancia. Es lo que define el cursor.",
          "type": "string",
          "format": "date-time"
        }
      }
    }
  }
}
