{
  "version": "v1",
  "tenant": "tenant-demo",
  "items": [
    {
      "alegraId": "12345",
      "visible": true,
      "nombre": "Lámpara colgante E27",
      "descripcion": "Apta para exterior.",
      "categoriaId": "8f3a0c7e-0000-4000-8000-000000000001",
      "orden": 0,
      "tagIds": ["1b7c0c7e-0000-4000-8000-000000000001"],
      "fotos": [
        { "url": "https://fotos.example/shop/tenant-demo/12345/0123456789abcdef01234567-1600.webp", "w": 1600, "alt": "Lámpara colgante vista de frente" },
        { "url": "https://fotos.example/shop/tenant-demo/12345/0123456789abcdef01234567-800.webp", "w": 800 }
      ],
      "updatedAt": "2026-09-18T12:00:00.123456Z"
    },
    {
      "alegraId": "12346",
      "visible": true,
      "nombre": null,
      "descripcion": null,
      "categoriaId": null,
      "orden": null,
      "tagIds": [],
      "fotos": [],
      "updatedAt": "2026-09-18T12:00:00.123456Z"
    },
    {
      "alegraId": "9001",
      "visible": false,
      "nombre": "Térmica bipolar 16A",
      "descripcion": null,
      "categoriaId": "8f3a0c7e-0000-4000-8000-000000000005",
      "orden": null,
      "tagIds": ["1b7c0c7e-0000-4000-8000-000000000001", "1b7c0c7e-0000-4000-8000-000000000002"],
      "fotos": [],
      "updatedAt": "2026-09-18T12:00:00.123456Z"
    }
  ],
  "nextCursor": { "desde": "2026-09-18T12:00:00.123456Z", "cursor": "9001" },
  "hasMore": true
}
